{
    "size": 8,
    "maxLife": 400,
    "type": "station",
    "gunSlots": [
        {
            "position": "0.79 0.7",
            "isUnderneathHull": false,
            "allowsRotation": true
        }
    ],
    "lightSrcPoss": [
        ".26 .93",
        ".73 .93"
    ],
    "forceBeaconPoss": [
        "0.185 0.756"
    ],
   "rigidBody": {
        "origin": {
            "x": 0.5075757503509521,
            "y": 0.5359848737716675
        },
        "polygons":[
            [
               {
                  "x":0.25499996542930603,
                  "y":0.8687499761581421
               },
               {
                  "x":0.16749992966651917,
                  "y":0.8687499761581421
               },
               {
                  "x":0.16499993205070496,
                  "y":0.6912500858306885
               },
               {
                  "x":0.19749993085861206,
                  "y":0.6187500357627869
               }
            ],
            [
               {
                  "x":0.19749993085861206,
                  "y":0.6187500357627869
               },
               {
                  "x":0.16249996423721313,
                  "y":0.581250011920929
               },
               {
                  "x":0.15999993681907654,
                  "y":0.5387499928474426
               },
               {
                  "x":0.20249995589256287,
                  "y":0.5387499928474426
               }
            ],
            [
               {
                  "x":0.690000057220459,
                  "y":0.3662499785423279
               },
               {
                  "x":0.7025001049041748,
                  "y":0.02124994993209839
               },
               {
                  "x":0.8500001430511475,
                  "y":0.02374991774559021
               },
               {
                  "x":0.9575001001358032,
                  "y":0.13374999165534973
               },
               {
                  "x":0.9525001049041748,
                  "y":0.7137500643730164
               }
            ],
            [
               {
                  "x":0.9525001049041748,
                  "y":0.7137500643730164
               },
               {
                  "x":0.8475000858306885,
                  "y":0.8212500214576721
               },
               {
                  "x":0.625,
                  "y":0.8187500238418579
               },
               {
                  "x":0.6525000333786011,
                  "y":0.38874998688697815
               },
               {
                  "x":0.690000057220459,
                  "y":0.3662499785423279
               }
            ],
            [
               {
                  "x":0.625,
                  "y":0.8187500238418579
               },
               {
                  "x":0.39499998092651367,
                  "y":0.90625
               },
               {
                  "x":0.3125,
                  "y":0.90625
               },
               {
                  "x":0.25499996542930603,
                  "y":0.8687499761581421
               },
               {
                  "x":0.19749993085861206,
                  "y":0.6187500357627869
               },
               {
                  "x":0.20249995589256287,
                  "y":0.5387499928474426
               },
               {
                  "x":0.34999996423721313,
                  "y":0.38624998927116394
               },
               {
                  "x":0.6525000333786011,
                  "y":0.38874998688697815
               }
            ],
            [
               {
                  "x":0.625,
                  "y":0.8187500238418579
               },
               {
                  "x":0.5749999284744263,
                  "y":0.96875
               },
               {
                  "x":0.41999995708465576,
                  "y":0.971250057220459
               },
               {
                  "x":0.39499998092651367,
                  "y":0.90625
               }
            ]
         ],
         "circles":[

         ],
         "shapes":[
            {
               "type":"POLYGON",
               "vertices":[
                  {
                     "x":0.41999995708465576,
                     "y":0.971250057220459
                  },
                  {
                     "x":0.5749999284744263,
                     "y":0.96875
                  },
                  {
                     "x":0.625,
                     "y":0.8187500238418579
                  },
                  {
                     "x":0.8475000858306885,
                     "y":0.8212500214576721
                  },
                  {
                     "x":0.9525001049041748,
                     "y":0.7137500643730164
                  },
                  {
                     "x":0.9575001001358032,
                     "y":0.13374999165534973
                  },
                  {
                     "x":0.8500001430511475,
                     "y":0.02374991774559021
                  },
                  {
                     "x":0.7025001049041748,
                     "y":0.02124994993209839
                  },
                  {
                     "x":0.690000057220459,
                     "y":0.3662499785423279
                  },
                  {
                     "x":0.6525000333786011,
                     "y":0.38874998688697815
                  },
                  {
                     "x":0.34999996423721313,
                     "y":0.38624998927116394
                  },
                  {
                     "x":0.20249995589256287,
                     "y":0.5387499928474426
                  },
                  {
                     "x":0.15999993681907654,
                     "y":0.5387499928474426
                  },
                  {
                     "x":0.16249996423721313,
                     "y":0.581250011920929
                  },
                  {
                     "x":0.19749993085861206,
                     "y":0.6187500357627869
                  },
                  {
                     "x":0.16499993205070496,
                     "y":0.6912500858306885
                  },
                  {
                     "x":0.16749992966651917,
                     "y":0.8687499761581421
                  },
                  {
                     "x":0.25499996542930603,
                     "y":0.8687499761581421
                  },
                  {
                     "x":0.3125,
                     "y":0.90625
                  },
                  {
                     "x":0.39499998092651367,
                     "y":0.90625
                  }
               ]
            }
         ]
    }
}