{
    "size": 3.5,
    "maxLife": 120,
    "type": "big",
    "gunSlots": [
        {
            "position": "0.64 0.5",
            "isUnderneathHull": false,
            "allowsRotation": true
        },
        {
            "position": "0.36 0.5",
            "isUnderneathHull": false,
            "allowsRotation": true
        }
    ],
    "forceBeaconPoss": [
        "0.5 0.25",
        "0.5 0.75"
    ],
    "doorPoss": [
        "0.5 0.13",
        "0.5 0.87"
    ],
    "engine": "core:imperialBigEngine",
    "rigidBody": {
       "origin":{"x":0.48249998688697815,"y":0.48374998569488525},"polygons":[[{"x":0.7275000214576721,"y":0.7450000047683716},{"x":0.7225000262260437,"y":0.8725000023841858},{"x":0.2774999737739563,"y":0.8700000047683716},{"x":0.26749998331069946,"y":0.7000000476837158}],[{"x":0.26749998331069946,"y":0.7000000476837158},{"x":0.1925000250339508,"y":0.76500004529953},{"x":0.06999999284744263,"y":0.6775000095367432},{"x":0.06999999284744263,"y":0.3199999928474426},{"x":0.1824999749660492,"y":0.23749995231628418},{"x":0.27000001072883606,"y":0.29749995470046997}],[{"x":0.7325000762939453,"y":0.2499999701976776},{"x":0.9000000953674316,"y":0.2524999678134918},{"x":0.8875000476837158,"y":0.7400000095367432},{"x":0.7275000214576721,"y":0.7450000047683716}],[{"x":0.7275000214576721,"y":0.7450000047683716},{"x":0.26749998331069946,"y":0.7000000476837158},{"x":0.27000001072883606,"y":0.29749995470046997},{"x":0.2749999761581421,"y":0.1274999976158142},{"x":0.7325000762939453,"y":0.12999996542930603},{"x":0.7325000762939453,"y":0.2499999701976776}]],"circles":[],"shapes":[{"type":"POLYGON","vertices":[{"x":0.7275000214576721,"y":0.7450000047683716},{"x":0.7225000262260437,"y":0.8725000023841858},{"x":0.2774999737739563,"y":0.8700000047683716},{"x":0.26749998331069946,"y":0.7000000476837158},{"x":0.1925000250339508,"y":0.76500004529953},{"x":0.06999999284744263,"y":0.6775000095367432},{"x":0.06999999284744263,"y":0.3199999928474426},{"x":0.1824999749660492,"y":0.23749995231628418},{"x":0.27000001072883606,"y":0.29749995470046997},{"x":0.2749999761581421,"y":0.1274999976158142},{"x":0.7325000762939453,"y":0.12999996542930603},{"x":0.7325000762939453,"y":0.2499999701976776},{"x":0.9000000953674316,"y":0.2524999678134918},{"x":0.8875000476837158,"y":0.7400000095367432}]}]
    },
    "particleEmitters": [
        {
            "position": "0.09 0.38",
            "trigger": "engine",
            "hasLight": true,
            "particle": {
                "effectFile": "core:flame",
                "size": 0.3,
                "tex": "core:fire",
                "tint": "hsb 140 20 65"
            },
            "workSounds": [
                "core:medEngineWork0",
                "core:medEngineWork1",
                "core:medEngineWork2",
                "core:medEngineWork3",
                "core:medEngineWork4"
            ]
        },
        {
            "position": "0.09 0.62",
            "trigger": "engine",
            "hasLight": true,
            "particle": {
                "effectFile": "core:flame",
                "size": 0.3,
                "tex": "core:fire",
                "tint": "hsb 140 20 65"
            },
            "workSounds": [
                "core:medEngineWork0",
                "core:medEngineWork1",
                "core:medEngineWork2",
                "core:medEngineWork3",
                "core:medEngineWork4"
            ]
        }
    ]
}
