{
    "size": 1.7,
    "maxLife": 75,
    "type": "station",
    "gunSlots": [
        {
            "position": "0.5 0.14",
            "isUnderneathHull": false,
            "allowsRotation": true
        },
        {
            "position": "0.5 0.38",
            "isUnderneathHull": false,
            "allowsRotation": true
        }
    ],
    "lightSrcPoss": [
        ".47 .01"
    ],
    "rigidBody": {
        "origin": {
            "x": 0.5050000548362732,
            "y": 0.7112500071525574
        },
        "polygons": [
            [
                {
                    "x": 0.21500001847743988,
                    "y": 0.35187503695487976
                },
                {
                    "x": 0.23749999701976776,
                    "y": 0.37187501788139343
                },
                {
                    "x": 0.08624998480081558,
                    "y": 0.5293750166893005
                },
                {
                    "x": 0.0637500062584877,
                    "y": 0.5043750405311584
                }
            ],
            [
                {
                    "x": 0.7887499928474426,
                    "y": 0.35062500834465027
                },
                {
                    "x": 0.9399999976158142,
                    "y": 0.503125011920929
                },
                {
                    "x": 0.9174999594688416,
                    "y": 0.5268750190734863
                },
                {
                    "x": 0.7662500143051147,
                    "y": 0.37187501788139343
                }
            ],
            [
                {
                    "x": 0.8637500405311584,
                    "y": 0.2718750238418579
                },
                {
                    "x": 0.7950000166893005,
                    "y": 0.34062501788139343
                },
                {
                    "x": 0.20749999582767487,
                    "y": 0.34187501668930054
                },
                {
                    "x": 0.13625000417232513,
                    "y": 0.2631250321865082
                }
            ],
            [
                {
                    "x": 0.5387500524520874,
                    "y": 0.3243750333786011
                },
                {
                    "x": 0.5287500023841858,
                    "y": 0.5731250047683716
                },
                {
                    "x": 0.4675000011920929,
                    "y": 0.5718750357627869
                },
                {
                    "x": 0.4612500071525574,
                    "y": 0.3318750262260437
                }
            ]
        ],
        "circles": [
            {
                "cx": 0.5049999952316284,
                "cy": 0.7341667413711548,
                "r": 0.17288410663604736
            },
            {
                "cx": 0.6483333706855774,
                "cy": 0.5441666841506958,
                "r": 0.04737560451030731
            },
            {
                "cx": 0.7450000047683716,
                "cy": 0.7325000166893005,
                "r": 0.05459454283118248
            },
            {
                "cx": 0.258333295583725,
                "cy": 0.7341667413711548,
                "r": 0.05520165339112282
            },
            {
                "cx": 0.35499998927116394,
                "cy": 0.5425000190734863,
                "r": 0.04693375900387764
            },
            {
                "cx": 0.6449999809265137,
                "cy": 0.9212499260902405,
                "r": 0.046703923493623734
            },
            {
                "cx": 0.36250004172325134,
                "cy": 0.9237499833106995,
                "r": 0.050559353083372116
            }
        ],
        "shapes": [
            {
                "type": "CIRCLE",
                "vertices": [
                    {
                        "x": 0.5049999952316284,
                        "y": 0.7341667413711548
                    },
                    {
                        "x": 0.6483333706855774,
                        "y": 0.637499988079071
                    }
                ]
            },
            {
                "type": "CIRCLE",
                "vertices": [
                    {
                        "x": 0.6483333706855774,
                        "y": 0.5441666841506958
                    },
                    {
                        "x": 0.6850000619888306,
                        "y": 0.5141666531562805
                    }
                ]
            },
            {
                "type": "CIRCLE",
                "vertices": [
                    {
                        "x": 0.7450000047683716,
                        "y": 0.7325000166893005
                    },
                    {
                        "x": 0.7916667461395264,
                        "y": 0.7041666507720947
                    }
                ]
            },
            {
                "type": "CIRCLE",
                "vertices": [
                    {
                        "x": 0.258333295583725,
                        "y": 0.7341667413711548
                    },
                    {
                        "x": 0.30666661262512207,
                        "y": 0.7075000405311584
                    }
                ]
            },
            {
                "type": "CIRCLE",
                "vertices": [
                    {
                        "x": 0.35499998927116394,
                        "y": 0.5425000190734863
                    },
                    {
                        "x": 0.3999999761581421,
                        "y": 0.5291666388511658
                    }
                ]
            },
            {
                "type": "CIRCLE",
                "vertices": [
                    {
                        "x": 0.6449999809265137,
                        "y": 0.9212499260902405
                    },
                    {
                        "x": 0.690000057220459,
                        "y": 0.9087499380111694
                    }
                ]
            },
            {
                "type": "CIRCLE",
                "vertices": [
                    {
                        "x": 0.36250004172325134,
                        "y": 0.9237499833106995
                    },
                    {
                        "x": 0.4125000238418579,
                        "y": 0.9162499904632568
                    }
                ]
            },
            {
                "type": "POLYGON",
                "vertices": [
                    {
                        "x": 0.0637500062584877,
                        "y": 0.5043750405311584
                    },
                    {
                        "x": 0.08624998480081558,
                        "y": 0.5293750166893005
                    },
                    {
                        "x": 0.23749999701976776,
                        "y": 0.37187501788139343
                    },
                    {
                        "x": 0.21500001847743988,
                        "y": 0.35187503695487976
                    }
                ]
            },
            {
                "type": "POLYGON",
                "vertices": [
                    {
                        "x": 0.7662500143051147,
                        "y": 0.37187501788139343
                    },
                    {
                        "x": 0.9174999594688416,
                        "y": 0.5268750190734863
                    },
                    {
                        "x": 0.9399999976158142,
                        "y": 0.503125011920929
                    },
                    {
                        "x": 0.7887499928474426,
                        "y": 0.35062500834465027
                    }
                ]
            },
            {
                "type": "POLYGON",
                "vertices": [
                    {
                        "x": 0.13625000417232513,
                        "y": 0.2631250321865082
                    },
                    {
                        "x": 0.20749999582767487,
                        "y": 0.34187501668930054
                    },
                    {
                        "x": 0.7950000166893005,
                        "y": 0.34062501788139343
                    },
                    {
                        "x": 0.8637500405311584,
                        "y": 0.2718750238418579
                    }
                ]
            },
            {
                "type": "POLYGON",
                "vertices": [
                    {
                        "x": 0.4612500071525574,
                        "y": 0.3318750262260437
                    },
                    {
                        "x": 0.4675000011920929,
                        "y": 0.5718750357627869
                    },
                    {
                        "x": 0.5287500023841858,
                        "y": 0.5731250047683716
                    },
                    {
                        "x": 0.5387500524520874,
                        "y": 0.3243750333786011
                    }
                ]
            }
        ]
    }
}