{
  "size": 10,
  "maxLife": 1000,
  "type": "station",
  "gunSlots": [
    {
      "position": "0.080078125 0.5234375",
      "isUnderneathHull": false,
      "allowsRotation": true
    },
    {
      "position": "0.91796875 0.5234375",
      "isUnderneathHull": false,
      "allowsRotation": true
    }
  ],
  "lightSrcPoss": [
    "0.080078125 0.5234375",
    "0.91796875 0.5234375"
  ],
  "forceBeaconPoss": [
    "0.26171875 0.498046875",
    "0.759765625 0.498046875"
  ],
  "rigidBody": {
    "origin": {
      "x": 0.5,
      "y": 0.5
    },
    "polygons": [],
    "circles": [
      {
        "cx": 0.5079167485237122,
        "cy": 0.46166640520095825,
        "r": 0.20926126837730408
      },
      {
        "cx": 0.3097917139530182,
        "cy": 0.438958078622818,
        "r": 0.06629715114831924
      },
      {
        "cx": 0.5935417413711548,
        "cy": 0.30395811796188354,
        "r": 0.05857690051198006
      },
      {
        "cx": 0.39229172468185425,
        "cy": 0.3414580821990967,
        "r": 0.06434766203165054
      }
    ],
    "shapes": [
      {
        "type": "CIRCLE",
        "vertices": [
          {
            "x": 0.5079167485237122,
            "y": 0.46166640520095825
          },
          {
            "x": 0.6187500953674316,
            "y": 0.2841663956642151
          }
        ]
      },
      {
        "type": "CIRCLE",
        "vertices": [
          {
            "x": 0.3097917139530182,
            "y": 0.438958078622818
          },
          {
            "x": 0.35604172945022583,
            "y": 0.39145809412002563
          }
        ]
      },
      {
        "type": "CIRCLE",
        "vertices": [
          {
            "x": 0.5935417413711548,
            "y": 0.30395811796188354
          },
          {
            "x": 0.6385417580604553,
            "y": 0.26645809412002563
          }
        ]
      },
      {
        "type": "CIRCLE",
        "vertices": [
          {
            "x": 0.39229172468185425,
            "y": 0.3414580821990967
          },
          {
            "x": 0.42354172468185425,
            "y": 0.2852081060409546
          }
        ]
      }
    ]
  }
}
