{
    "size": 3.5,
    "maxLife": 800,
    "type": "big",
    "price": 20000,
    "displayName": "Imperial Capital Ship",
    "engine": "core:imperialBigEngine",
    "gunSlots": [
        {
            "position": "0.276 0.2935",
            "isUnderneathHull": false,
            "allowsRotation": true
        },
        {
            "position": "0.276 0.7075",
            "isUnderneathHull": false,
            "allowsRotation": true
        }
    ],
    "rigidBody": {
       "origin":{"x":0.51624995470047,"y":0.5012499690055847},"polygons":[[{"x":0.1199999749660492,"y":0.4350000023841858},{"x":0.05249994993209839,"y":0.3700000047683716},{"x":0.27000001072883606,"y":0.1799999475479126}],[{"x":0.27000001072883606,"y":0.1799999475479126},{"x":0.9925000667572021,"y":0.4675000011920929},{"x":0.11749997735023499,"y":0.5550000071525574},{"x":0.1199999749660492,"y":0.4350000023841858}],[{"x":0.9925000667572021,"y":0.4675000011920929},{"x":0.9900000095367432,"y":0.5400000214576721},{"x":0.27000001072883606,"y":0.8125},{"x":0.06499996781349182,"y":0.6424999833106995},{"x":0.11749997735023499,"y":0.5550000071525574}]],"circles":[],"shapes":[{"type":"POLYGON","vertices":[{"x":0.9900000095367432,"y":0.5400000214576721},{"x":0.27000001072883606,"y":0.8125},{"x":0.06499996781349182,"y":0.6424999833106995},{"x":0.11749997735023499,"y":0.5550000071525574},{"x":0.1199999749660492,"y":0.4350000023841858},{"x":0.05249994993209839,"y":0.3700000047683716},{"x":0.27000001072883606,"y":0.1799999475479126},{"x":0.9925000667572021,"y":0.4675000011920929}]}]
    },
    "particleEmitters": [
        {
            "position": "0.08 0.37",
            "trigger": "engine",
            "hasLight": true,
            "particle": {
                "effectFile": "core:flame",
                "size": 0.3,
                "tex": "core:fire",
                "tint": "hsb 140 20 65"
            },
            "workSounds": [
                "core:medEngineWork0",
                "core:medEngineWork1",
                "core:medEngineWork2",
                "core:medEngineWork3",
                "core:medEngineWork4"
            ]
        },
        {
            "position": "0.08 0.63",
            "trigger": "engine",
            "hasLight": true,
            "particle": {
                "effectFile": "core:flame",
                "size": 0.3,
                "tex": "core:fire",
                "tint": "hsb 140 20 65"
            },
            "workSounds": [
                "core:medEngineWork0",
                "core:medEngineWork1",
                "core:medEngineWork2",
                "core:medEngineWork3",
                "core:medEngineWork4"
            ]
        }
    ]
}
