{
    "size": 0.8,
    "maxLife": 46,
    "type": "station",
    "gunSlots": [
        {
            "position": "0.51 0.21",
            "isUnderneathHull": false,
            "allowsRotation": true
        }
    ],
    "rigidBody": {
        "origin": {
            "x": 0.5199999809265137,
            "y": 0.6737500429153442
        },
        "polygons": [
            [
                {
                    "x": 0.7599999904632568,
                    "y": 0.26375001668930054
                },
                {
                    "x": 0.5227272510528564,
                    "y": 0.7443181276321411
                },
                {
                    "x": 0.2800000309944153,
                    "y": 0.2562500536441803
                }
            ],
            [
                {
                    "x": 0.5227272510528564,
                    "y": 0.36174243688583374
                },
                {
                    "x": 0.6287879347801208,
                    "y": 0.8996212482452393
                },
                {
                    "x": 0.39772728085517883,
                    "y": 0.9071969389915466
                }
            ]
        ],
        "circles": [
        ],
        "shapes": [
            {
                "type": "POLYGON",
                "vertices": [
                    {
                        "x": 0.2800000309944153,
                        "y": 0.2562500536441803
                    },
                    {
                        "x": 0.5227272510528564,
                        "y": 0.7443181276321411
                    },
                    {
                        "x": 0.7599999904632568,
                        "y": 0.26375001668930054
                    }
                ]
            },
            {
                "type": "POLYGON",
                "vertices": [
                    {
                        "x": 0.39772728085517883,
                        "y": 0.9071969389915466
                    },
                    {
                        "x": 0.6287879347801208,
                        "y": 0.8996212482452393
                    },
                    {
                        "x": 0.5227272510528564,
                        "y": 0.36174243688583374
                    }
                ]
            }
        ]
    }
}