{
    "size": 1,
    "maxLife": 80,
    "type": "std",
    "price": 2000,
    "ability": {
        "type": "sloMo",
        "factor": 0.3,
        "rechargeTime": 5
    },
    "displayName": "empireguard",
    "engine": "core:imperialEngine",
    "gunSlots": [
        {
            "position": "0.54 0.10",
            "isUnderneathHull": false,
            "allowsRotation": false
        },
        {
            "position": "0.54 0.74",
            "isUnderneathHull": false,
            "allowsRotation": true
        }
    ],
    "rigidBody": {"name":"lship","imagePath":"../DestinationSol/modules/empire/assets/ships/empireLarge/empireLarge.png","origin":{"x":0.5,"y":0.5},
        "polygons":[[{"x":0.0625,"y":0.75},{"x":0.01171875,"y":0.75390625},{"x":0,"y":0.66015625},{"x":0.07524425536394119,"y":0.7243351936340332}],[{"x":0.1328125,"y":0.7734375},{"x":0.0703125,"y":0.77734375},{"x":0.0625,"y":0.75},{"x":0.07524425536394119,"y":0.7243351936340332}],[{"x":0,"y":0.66015625},{"x":0.01171875,"y":0.6171875},{"x":0.19140625,"y":0.79296875},{"x":0.1328125,"y":0.7734375}],[{"x":0.0703125,"y":0.51171875},{"x":0.078125,"y":0.48828125},{"x":0.17578125,"y":0.48046875},{"x":0.2265625,"y":0.82421875},{"x":0.19140625,"y":0.79296875}],[{"x":0.19140625,"y":0.79296875},{"x":0.01171875,"y":0.6171875},{"x":0,"y":0.56640625},{"x":0.0078125,"y":0.51171875},{"x":0.0703125,"y":0.51171875}],[{"x":0.1796875,"y":0.32421875},{"x":0.06640625,"y":0.2890625},{"x":0.078125,"y":0.27734375},{"x":0.3359375,"y":0.265625},{"x":0.59765625,"y":0.2734375}],[{"x":0.59765625,"y":0.2734375},{"x":0.734375,"y":0.296875},{"x":0.8203125,"y":0.328125},{"x":0.80859375,"y":0.33984375},{"x":0.67578125,"y":0.34375},{"x":0.1796875,"y":0.32421875}],[{"x":0.67578125,"y":0.34375},{"x":0.6328125,"y":0.375},{"x":0.23828125,"y":0.36328125},{"x":0.1796875,"y":0.32421875}],[{"x":0.6328125,"y":0.375},{"x":0.61328125,"y":0.4140625},{"x":0.23828125,"y":0.41015625},{"x":0.23828125,"y":0.36328125}],[{"x":0.859375,"y":0.453125},{"x":0.9921875,"y":0.50390625},{"x":0.828125,"y":0.50390625}],[{"x":0.828125,"y":0.50390625},{"x":0.80859375,"y":0.51953125},{"x":0.70703125,"y":0.51953125},{"x":0.67578125,"y":0.50390625},{"x":0.70703125,"y":0.43359375},{"x":0.77734375,"y":0.41796875},{"x":0.84375,"y":0.4296875},{"x":0.859375,"y":0.453125}],[{"x":0.67578125,"y":0.50390625},{"x":0.59375,"y":0.5078125},{"x":0.62109375,"y":0.4296875},{"x":0.70703125,"y":0.43359375}],[{"x":0.59375,"y":0.5078125},{"x":0.21484375,"y":0.453125},{"x":0.23828125,"y":0.41015625},{"x":0.61328125,"y":0.4140625},{"x":0.62109375,"y":0.4296875}],[{"x":0.7265625,"y":0.59765625},{"x":0.77734375,"y":0.62890625},{"x":0.76171875,"y":0.65625},{"x":0.72265625,"y":0.671875}],[{"x":0.72265625,"y":0.671875},{"x":0.66015625,"y":0.55859375},{"x":0.7265625,"y":0.578125},{"x":0.7265625,"y":0.59765625}],[{"x":0.66015625,"y":0.70703125},{"x":0.59375,"y":0.7421875},{"x":0.23828125,"y":0.86328125},{"x":0.2265625,"y":0.82421875},{"x":0.17578125,"y":0.48046875},{"x":0.21484375,"y":0.453125},{"x":0.59375,"y":0.5078125},{"x":0.66015625,"y":0.55859375}],[{"x":0.66015625,"y":0.55859375},{"x":0.72265625,"y":0.671875},{"x":0.703125,"y":0.703125},{"x":0.66015625,"y":0.70703125}],[{"x":0.83984375,"y":0.76171875},{"x":0.98046875,"y":0.76171875},{"x":0.9453125,"y":0.7890625},{"x":0.76953125,"y":0.84765625}],[{"x":0.76953125,"y":0.84765625},{"x":0.71484375,"y":0.84765625},{"x":0.69140625,"y":0.83203125},{"x":0.68359375,"y":0.76171875},{"x":0.70703125,"y":0.74609375},{"x":0.8125,"y":0.74609375},{"x":0.83984375,"y":0.76171875}],[{"x":0.69140625,"y":0.83203125},{"x":0.62109375,"y":0.8359375},{"x":0.62109375,"y":0.76171875},{"x":0.68359375,"y":0.76171875}],[{"x":0.62109375,"y":0.8359375},{"x":0.61328125,"y":0.8515625},{"x":0.2265625,"y":0.921875},{"x":0.23828125,"y":0.86328125},{"x":0.59375,"y":0.7421875},{"x":0.62109375,"y":0.76171875}],[{"x":0.71484375,"y":0.92578125},{"x":0.828125,"y":0.92578125},{"x":0.80078125,"y":0.94921875},{"x":0.6953125,"y":0.9765625}],[{"x":0.6953125,"y":0.9765625},{"x":0.52734375,"y":0.99609375},{"x":0.6484375,"y":0.90625},{"x":0.71484375,"y":0.92578125}],[{"x":0.52734375,"y":0.99609375},{"x":0.296875,"y":1},{"x":0.07421875,"y":0.98828125},{"x":0.08203125,"y":0.97265625},{"x":0.2265625,"y":0.921875},{"x":0.61328125,"y":0.8515625},{"x":0.6484375,"y":0.90625}]],"circles":[],"shapes":[{"type":"POLYGON","vertices":[{"x":0.296875,"y":1},{"x":0.52734375,"y":0.99609375},{"x":0.6953125,"y":0.9765625},{"x":0.80078125,"y":0.94921875},{"x":0.828125,"y":0.92578125},{"x":0.71484375,"y":0.92578125},{"x":0.6484375,"y":0.90625},{"x":0.61328125,"y":0.8515625},{"x":0.62109375,"y":0.8359375},{"x":0.69140625,"y":0.83203125},{"x":0.71484375,"y":0.84765625},{"x":0.76953125,"y":0.84765625},{"x":0.9453125,"y":0.7890625},{"x":0.98046875,"y":0.76171875},{"x":0.83984375,"y":0.76171875},{"x":0.8125,"y":0.74609375},{"x":0.70703125,"y":0.74609375},{"x":0.68359375,"y":0.76171875},{"x":0.62109375,"y":0.76171875},{"x":0.59375,"y":0.7421875},{"x":0.66015625,"y":0.70703125},{"x":0.703125,"y":0.703125},{"x":0.72265625,"y":0.671875},{"x":0.76171875,"y":0.65625},{"x":0.77734375,"y":0.62890625},{"x":0.7265625,"y":0.59765625},{"x":0.7265625,"y":0.578125},{"x":0.66015625,"y":0.55859375},{"x":0.59375,"y":0.5078125},{"x":0.67578125,"y":0.50390625},{"x":0.70703125,"y":0.51953125},{"x":0.80859375,"y":0.51953125},{"x":0.828125,"y":0.50390625},{"x":0.9921875,"y":0.50390625},{"x":0.859375,"y":0.453125},{"x":0.84375,"y":0.4296875},{"x":0.77734375,"y":0.41796875},{"x":0.70703125,"y":0.43359375},{"x":0.62109375,"y":0.4296875},{"x":0.61328125,"y":0.4140625},{"x":0.6328125,"y":0.375},{"x":0.67578125,"y":0.34375},{"x":0.80859375,"y":0.33984375},{"x":0.8203125,"y":0.328125},{"x":0.734375,"y":0.296875},{"x":0.59765625,"y":0.2734375},{"x":0.3359375,"y":0.26562},{"x":0.078125,"y":0.27734375},{"x":0.06640625,"y":0.2890625},{"x":0.1796875,"y":0.32421875},{"x":0.23828125,"y":0.36328125},{"x":0.23828125,"y":0.41015625},{"x":0.21484375,"y":0.453125},{"x":0.17578125,"y":0.48046875},{"x":0.078125,"y":0.48828125},{"x":0.0703125,"y":0.51171875},{"x":0.0078125,"y":0.51171875},{"x":0,"y":0.56640625},{"x":0.01171875,"y":0.6171875},{"x":0,"y":0.66015625},{"x":0.01171875,"y":0.75390625},{"x":0.0625,"y":0.75},{"x":0.0703125,"y":0.77734375},{"x":0.1328125,"y":0.7734375},{"x":0.19140625,"y":0.79296875},{"x":0.2265625,"y":0.82421875},{"x":0.23828125,"y":0.86328125},{"x":0.2265625,"y":0.921875},{"x":0.08203125,"y":0.97265625},{"x":0.07421875,"y":0.98828125}]}]},
    "particleEmitters": [
        {
            "position": "0.11 0.41",
            "trigger": "engine",
            "hasLight": true,
            "particle": {
                "effectFile": "core:flame",
                "size": 0.07,
                "tex": "core:fire",
                "tint": "hsb 140 20 65"
            },
            "workSounds": [
                "core:medEngineWork0",
                "core:medEngineWork1",
                "core:medEngineWork2",
                "core:medEngineWork3",
                "core:medEngineWork4"
            ]
        },
        {
            "position": "0.11 0.41",
            "trigger": "engine",
            "hasLight": true,
            "particle": {
                "effectFile": "core:flame",
                "size": 0.07,
                "tex": "core:fire",
                "tint": "hsb 140 20 65"
            },
            "workSounds": [
                "core:medEngineWork0",
                "core:medEngineWork1",
                "core:medEngineWork2",
                "core:medEngineWork3",
                "core:medEngineWork4"
            ]
        }
    ]
}