{
    "size": 1,
    "maxLife": 80,
    "type": "std",
    "price": 2000,
    "ability": {
        "type": "sloMo",
        "factor": 0.3,
        "rechargeTime": 5
    },
    "displayName": "Vanguard",
    "engine": "core:imperialEngine",
    "gunSlots": [
        {
            "position": "0.54 0.26",
            "isUnderneathHull": false,
            "allowsRotation": false
        },
        {
            "position": "0.54 0.74",
            "isUnderneathHull": false,
            "allowsRotation": false
        }
    ],
    "rigidBody": {
      "origin":{"x":0.5524998307228088,"y":0.4962499141693115},"polygons":[[{"x":0.9300000667572021,"y":0.4975000023841858},{"x":0.5324999690055847,"y":0.8424999713897705},{"x":0.09499996900558472,"y":0.7925000190734863},{"x":0.054999977350234985,"y":0.5024999380111694},{"x":0.09249997138977051,"y":0.19749996066093445},{"x":0.5399999618530273,"y":0.15999996662139893}]],"circles":[],"shapes":[{"type":"POLYGON","vertices":[{"x":0.9300000667572021,"y":0.4975000023841858},{"x":0.5324999690055847,"y":0.8424999713897705},{"x":0.09499996900558472,"y":0.7925000190734863},{"x":0.054999977350234985,"y":0.5024999380111694},{"x":0.09249997138977051,"y":0.19749996066093445},{"x":0.5399999618530273,"y":0.15999996662139893}]}]
    },
    "particleEmitters": [
        {
            "position": "0.11 0.43",
            "trigger": "engine",
            "hasLight": true,
            "particle": {
                "effectFile": "core:flame",
                "size": 0.07,
                "tex": "core:fire",
                "tint": "hsb 140 20 65"
            },
            "workSounds": [
                "core:medEngineWork0",
                "core:medEngineWork1",
                "core:medEngineWork2",
                "core:medEngineWork3",
                "core:medEngineWork4"
            ]
        },
        {
            "position": "0.11 0.57",
            "trigger": "engine",
            "hasLight": true,
            "particle": {
                "effectFile": "core:flame",
                "size": 0.07,
                "tex": "core:fire",
                "tint": "hsb 140 20 65"
            },
            "workSounds": [
                "core:medEngineWork0",
                "core:medEngineWork1",
                "core:medEngineWork2",
                "core:medEngineWork3",
                "core:medEngineWork4"
            ]
        }
    ]
}
