{
    "size": 1.2,
    "maxLife": 75,
    "type": "std",
    "gunSlots": [
        {
            "position": "0.38 0.43",
            "isUnderneathHull": false,
            "allowsRotation": true
        },
        {
            "position": "0.62 0.57",
            "isUnderneathHull": false,
            "allowsRotation": true
        }
    ],
    "lightSrcPoss": [
        ".1 .5",
        ".9 .5"
    ],
    "rigidBody": {
     "origin":{"x":0.4925000071525574,"y":0.5},"polygons":[[{"x":0.029999971389770508,"y":0.574999988079071},{"x":0.029999971389770508,"y":0.41999998688697815},{"x":0.3174999952316284,"y":0.13499996066093445},{"x":0.6700000762939453,"y":0.13249999284744263},{"x":0.9599999785423279,"y":0.42499998211860657},{"x":0.9625000357627869,"y":0.5674999952316284},{"x":0.6574999690055847,"y":0.8774999976158142},{"x":0.3174999952316284,"y":0.8774999976158142}]],"circles":[],"shapes":[{"type":"POLYGON","vertices":[{"x":0.3174999952316284,"y":0.8774999976158142},{"x":0.6574999690055847,"y":0.8774999976158142},{"x":0.9625000357627869,"y":0.5674999952316284},{"x":0.9599999785423279,"y":0.42499998211860657},{"x":0.6700000762939453,"y":0.13249999284744263},{"x":0.3174999952316284,"y":0.13499996066093445},{"x":0.029999971389770508,"y":0.41999998688697815},{"x":0.029999971389770508,"y":0.574999988079071}]}]
    }
}
