{
    "size": 0.76,
    "maxLife": 26,
    "type": "std",
    "price": 300,
    "ability": {
        "type": "unShield",
        "amount": 8,
        "rechargeTime": 7
    },
    "displayName": "Orbiter",
    "engine": "core:pirateEngine",
    "gunSlots": [
        {
            "position": "0.47 0.39",
            "isUnderneathHull": false,
            "allowsRotation": true
        }
    ],
    "rigidBody": {
       "origin":{"x":0.5113636255264282,"y":0.4943181574344635},"polygons":[[{"x":0.5874999761581421,"y":0.7124999761581421},{"x":0.565000057220459,"y":0.8575000166893005},{"x":0.4000000059604645,"y":0.8550000190734863},{"x":0.39249998331069946,"y":0.7000000476837158}],[{"x":0.4125000238418579,"y":0.28749996423721313},{"x":0.41499996185302734,"y":0.13499996066093445},{"x":0.512499988079071,"y":0.12250000238418579},{"x":0.5225000381469727,"y":0.29249995946884155}],[{"x":0.5225000381469727,"y":0.29249995946884155},{"x":0.6100000143051147,"y":0.3024999797344208},{"x":0.6549999713897705,"y":0.4424999952316284},{"x":0.3374999761581421,"y":0.49000000953674316},{"x":0.3174999952316284,"y":0.3424999713897705},{"x":0.4125000238418579,"y":0.28749996423721313}],[{"x":0.6549999713897705,"y":0.4424999952316284},{"x":0.8299999833106995,"y":0.5900000333786011},{"x":0.6600000262260437,"y":0.7024999856948853},{"x":0.5874999761581421,"y":0.7124999761581421},{"x":0.39249998331069946,"y":0.7000000476837158},{"x":0.22749999165534973,"y":0.6200000047683716},{"x":0.23749998211860657,"y":0.5249999761581421},{"x":0.3374999761581421,"y":0.49000000953674316}]],"circles":[],"shapes":[{"type":"POLYGON","vertices":[{"x":0.8299999833106995,"y":0.5900000333786011},{"x":0.6600000262260437,"y":0.7024999856948853},{"x":0.5874999761581421,"y":0.7124999761581421},{"x":0.565000057220459,"y":0.8575000166893005},{"x":0.4000000059604645,"y":0.8550000190734863},{"x":0.39249998331069946,"y":0.7000000476837158},{"x":0.22749999165534973,"y":0.6200000047683716},{"x":0.23749998211860657,"y":0.5249999761581421},{"x":0.3374999761581421,"y":0.49000000953674316},{"x":0.3174999952316284,"y":0.3424999713897705},{"x":0.4125000238418579,"y":0.28749996423721313},{"x":0.41499996185302734,"y":0.13499996066093445},{"x":0.512499988079071,"y":0.12250000238418579},{"x":0.5225000381469727,"y":0.29249995946884155},{"x":0.6100000143051147,"y":0.3024999797344208},{"x":0.6549999713897705,"y":0.4424999952316284}]}]
    },
    "particleEmitters": [
        {
            "position": "0.23 0.42",
            "trigger": "engine",
            "hasLight": true,
            "particle": {
                "effectFile": "core:flame",
                "size": 0.07,
                "tex": "core:fire",
                "tint": "hsb 8 75 100"
            },
            "workSounds": [
                "core:medEngineWork0",
                "core:medEngineWork1",
                "core:medEngineWork2",
                "core:medEngineWork3",
                "core:medEngineWork4"
            ]
        },
        {
            "position": "0.35 0.61",
            "trigger": "engine",
            "hasLight": true,
            "particle": {
                "effectFile": "core:flame",
                "size": 0.07,
                "tex": "core:fire",
                "tint": "hsb 8 75 100"
            },
            "workSounds": [
                "core:medEngineWork0",
                "core:medEngineWork1",
                "core:medEngineWork2",
                "core:medEngineWork3",
                "core:medEngineWork4"
            ]
        }
    ]
}
