{
    "size": 0.5,
    "maxLife": 65,
    "type": "std",
    "price": 800,
    "ability": {
        "type": "teleport",
        "angle": 120,
        "rechargeTime": 4
    },
    "gunSlots": [
        {
            "position": "0.53 0.25",
            "isUnderneathHull": true,
            "allowsRotation": false
        },
        {
            "position": "0.53 0.75",
            "isUnderneathHull": true,
            "allowsRotation": false
        }
    ],
    "displayName": "Beetle",
    "engine": "core:desertEngine",
    "rigidBody": {
        "origin": {
            "x": 0.5378787517547607,
            "y": 0.4943181574344635
        },
        "polygons": [
            [{
                "x": 0.37333327531814575,
                "y": 0.22750002145767212
            }, {
                "x": 0.3766666352748871,
                "y": 0.10416671633720398
            }, {
                "x": 0.4750000238418579,
                "y": 0.022500038146972656
            }, {
                "x": 0.7383333444595337,
                "y": 0.29083335399627686
            }],
            [{
                "x": 0.7366667985916138,
                "y": 0.690833330154419
            }, {
                "x": 0.47833335399627686,
                "y": 0.9541666507720947
            }, {
                "x": 0.3700000047683716,
                "y": 0.87583327293396
            }, {
                "x": 0.37333327531814575,
                "y": 0.7558333873748779
            }],
            [{
                "x": 0.37333327531814575,
                "y": 0.7558333873748779
            }, {
                "x": 0.29666662216186523,
                "y": 0.7174999713897705
            }, {
                "x": 0.2933332920074463,
                "y": 0.2658333480358124
            }, {
                "x": 0.7899999618530273,
                "y": 0.48750001192092896
            }, {
                "x": 0.9933334589004517,
                "y": 0.59416663646698
            }, {
                "x": 0.7366667985916138,
                "y": 0.690833330154419
            }],
            [{
                "x": 0.2933332920074463,
                "y": 0.2658333480358124
            }, {
                "x": 0.37333327531814575,
                "y": 0.22750002145767212
            }, {
                "x": 0.7383333444595337,
                "y": 0.29083335399627686
            }, {
                "x": 0.9850000143051147,
                "y": 0.3891666829586029
            }, {
                "x": 0.7899999618530273,
                "y": 0.48750001192092896
            }],
            [{
                "x": 0.29666662216186523,
                "y": 0.7174999713897705
            }, {
                "x": 0.18666663765907288,
                "y": 0.7774999737739563
            }, {
                "x": 0.04833325743675232,
                "y": 0.6941666603088379
            }, {
                "x": 0.044999927282333374,
                "y": 0.27916669845581055
            }, {
                "x": 0.1899999976158142,
                "y": 0.210833340883255
            }, {
                "x": 0.2933332920074463,
                "y": 0.2658333480358124
            }]
        ],
        "circles": [],
        "shapes": [{
            "type": "POLYGON",
            "vertices": [{
                "x": 0.04833325743675232,
                "y": 0.6941666603088379
            }, {
                "x": 0.044999927282333374,
                "y": 0.27916669845581055
            }, {
                "x": 0.1899999976158142,
                "y": 0.210833340883255
            }, {
                "x": 0.2933332920074463,
                "y": 0.2658333480358124
            }, {
                "x": 0.37333327531814575,
                "y": 0.22750002145767212
            }, {
                "x": 0.3766666352748871,
                "y": 0.10416671633720398
            }, {
                "x": 0.4750000238418579,
                "y": 0.022500038146972656
            }, {
                "x": 0.7383333444595337,
                "y": 0.29083335399627686
            }, {
                "x": 0.9850000143051147,
                "y": 0.3891666829586029
            }, {
                "x": 0.7899999618530273,
                "y": 0.48750001192092896
            }, {
                "x": 0.9933334589004517,
                "y": 0.59416663646698
            }, {
                "x": 0.7366667985916138,
                "y": 0.690833330154419
            }, {
                "x": 0.47833335399627686,
                "y": 0.9541666507720947
            }, {
                "x": 0.3700000047683716,
                "y": 0.87583327293396
            }, {
                "x": 0.37333327531814575,
                "y": 0.7558333873748779
            }, {
                "x": 0.29666662216186523,
                "y": 0.7174999713897705
            }, {
                "x": 0.18666663765907288,
                "y": 0.7774999737739563
            }]
        }]
    },
    "particleEmitters": [
        {
            "position": "0.02 0.46",
            "trigger": "engine",
            "hasLight": true,
            "particle": {
                "effectFile": "core:flame",
                "size": 0.07,
                "tex": "core:smoke",
                "tint": "fire"
            },
            "workSounds": [
                "core:medEngineWork0",
                "core:medEngineWork1",
                "core:medEngineWork2",
                "core:medEngineWork3",
                "core:medEngineWork4"
            ]
        },
        {
            "position": "0.02 0.54",
            "trigger": "engine",
            "hasLight": true,
            "particle": {
                "effectFile": "core:flame",
                "size": 0.07,
                "tex": "core:smoke",
                "tint": "fire"
            },
            "workSounds": [
                "core:medEngineWork0",
                "core:medEngineWork1",
                "core:medEngineWork2",
                "core:medEngineWork3",
                "core:medEngineWork4"
            ]
        }
    ]
}