{
    "size": 0.9,
    "maxLife": 70,
    "type": "std",
    "price": 1600,
    "ability": {
        "type": "teleport",
        "angle": 180,
        "rechargeTime": 4
    },
    "displayName": "patrol",
    "engine": "core:desertEngine",
    "gunSlots": [
        {
            "position": "0.2 0.32",
            "isUnderneathHull": false,
            "allowsRotation": true
        },
        {
            "position": "0.2 0.68",
            "isUnderneathHull": false,
            "allowsRotation": true
        }
    ],
    "rigidBody": {"name":"Name","imagePath":"../DestinationSol/modules/empire/assets/ships/empireMedium/empireMedium.png","origin":{"x":0.5,"y":0.5},
"polygons":[[{"x":0.12844036519527435,"y":0.7889907956123352},{"x":0.07339449226856232,"y":0.7431192398071289},{"x":0.07339449226856232,"y":0.5871559381484985},{"x":0.12844036519527435,"y":0.5137614607810974}],[{"x":0.12844036519527435,"y":0.5137614607810974},{"x":0.07339449226856232,"y":0.44954127073287964},{"x":0.08256880939006805,"y":0.29357796907424927},{"x":0.1376146823167801,"y":0.2568807005882263}],[{"x":0.11009174585342407,"y":0.17431187629699707},{"x":0,"y":0.07339447736740112},{"x":0.01834862306714058,"y":0.027522921562194824},{"x":0.1376146823167801,"y":0.027522921562194824}],[{"x":0.1376146823167801,"y":0.027522921562194824},{"x":0.3486238420009613,"y":0.11926603317260742},{"x":0.1376146823167801,"y":0.2568807005882263},{"x":0.11009174585342407,"y":0.17431187629699707}],[{"x":0.8256880640983582,"y":0.8715596199035645},{"x":0.963302731513977,"y":0.8807339072227478},{"x":0.963302731513977,"y":0.9082568883895874},{"x":0.8165137767791748,"y":0.9174311757087708}],[{"x":0.8165137767791748,"y":0.9174311757087708},{"x":0.8440366983413696,"y":0.9541283845901489},{"x":0.6880733966827393,"y":0.9816513657569885},{"x":0.7155963182449341,"y":0.8256880640983582}],[{"x":0.7155963182449341,"y":0.8256880640983582},{"x":0.8165137767791748,"y":0.8348623514175415},{"x":0.8256880640983582,"y":0.8715596199035645},{"x":0.8165137767791748,"y":0.9174311757087708}],[{"x":0.6880733966827393,"y":0.9816513657569885},{"x":0.3669724762439728,"y":0.9816513657569885},{"x":0.302752286195755,"y":0.9357798099517822},{"x":0.6547293663024902,"y":0.7291845083236694},{"x":0.7064220309257507,"y":0.7798165082931519},{"x":0.7155963182449341,"y":0.8256880640983582}],[{"x":0.6547293663024902,"y":0.7291845083236694},{"x":0.7155963182449341,"y":0.7247706055641174},{"x":0.752293586730957,"y":0.7431192398071289},{"x":0.7064220309257507,"y":0.7798165082931519}],[{"x":0.7247706651687622,"y":0.6880733966827393},{"x":0.752293586730957,"y":0.7155963182449341},{"x":0.7155963182449341,"y":0.7247706055641174},{"x":0.6547293663024902,"y":0.7291845083236694}],[{"x":0.302752286195755,"y":0.9357798099517822},{"x":0.6739327311515808,"y":0.3283935487270355},{"x":0.7339449524879456,"y":0.37614673376083374},{"x":0.8165137767791748,"y":0.44954127073287964},{"x":0.8348624110221863,"y":0.5504586696624756},{"x":0.7981651425361633,"y":0.6330274939537048},{"x":0.7247706651687622,"y":0.6880733966827393}],[{"x":0.6739327311515808,"y":0.3283935487270355},{"x":0.7155963182449341,"y":0.33027517795562744},{"x":0.752293586730957,"y":0.3486238121986389},{"x":0.7339449524879456,"y":0.37614673376083374}],[{"x":0.7064220309257507,"y":0.2752293348312378},{"x":0.752293586730957,"y":0.3211008906364441},{"x":0.7155963182449341,"y":0.33027517795562744},{"x":0.6739327311515808,"y":0.3283935487270355}],[{"x":0.302752286195755,"y":0.9357798099517822},{"x":0.12844036519527435,"y":0.853210985660553},{"x":0.12844036519527435,"y":0.7889907956123352},{"x":0.12844036519527435,"y":0.5137614607810974},{"x":0.1376146823167801,"y":0.2568807005882263},{"x":0.7247706651687622,"y":0.2293577790260315},{"x":0.7064220309257507,"y":0.2752293348312378}],[{"x":0.1376146823167801,"y":0.2568807005882263},{"x":0.8256880640983582,"y":0.14678895473480225},{"x":0.8256880640983582,"y":0.1834862232208252},{"x":0.8165137767791748,"y":0.22018343210220337},{"x":0.7247706651687622,"y":0.2293577790260315}],[{"x":0.8256880640983582,"y":0.14678895473480225},{"x":0.963302731513977,"y":0.14678895473480225},{"x":0.963302731513977,"y":0.17431187629699707},{"x":0.8256880640983582,"y":0.1834862232208252}],[{"x":0.1376146823167801,"y":0.2568807005882263},{"x":0.3486238420009613,"y":0.11926603317260742},{"x":0.4403669834136963,"y":0.064220130443573},{"x":0.7155963182449341,"y":0.07339447736740112},{"x":0.8623853325843811,"y":0.11926603317260742},{"x":0.8256880640983582,"y":0.14678895473480225}],[{"x":0.302752286195755,"y":0.9357798099517822},{"x":0.03669724613428116,"y":1.0550458431243896},{"x":0.00917431153357029,"y":1.0091742277145386},{"x":0.00917431153357029,"y":0.963302731513977},{"x":0.12844036519527435,"y":0.853210985660553}]],"circles":[],"shapes":[{"type":"POLYGON","vertices":[{"x":0.03669724613428116,"y":1.0550458431243896},{"x":0.302752286195755,"y":0.9357798099517822},{"x":0.3669724762439728,"y":0.9816513657569885},{"x":0.6880733966827393,"y":0.9816513657569885},{"x":0.8440366983413696,"y":0.9541283845901489},{"x":0.8165137767791748,"y":0.9174311757087708},{"x":0.963302731513977,"y":0.9082568883895874},{"x":0.963302731513977,"y":0.8807339072227478},{"x":0.8256880640983582,"y":0.8715596199035645},{"x":0.8165137767791748,"y":0.8348623514175415},{"x":0.7155963182449341,"y":0.8256880640983582},{"x":0.7064220309257507,"y":0.7798165082931519},{"x":0.752293586730957,"y":0.7431192398071289},{"x":0.7155963182449341,"y":0.7247706055641174},{"x":0.752293586730957,"y":0.7155963182449341},{"x":0.7247706651687622,"y":0.6880733966827393},{"x":0.7981651425361633,"y":0.6330274939537048},{"x":0.8348624110221863,"y":0.5504586696624756},{"x":0.8165137767791748,"y":0.44954127073287964},{"x":0.7339449524879456,"y":0.37614673376083374},{"x":0.752293586730957,"y":0.3486238121986389},{"x":0.7155963182449341,"y":0.33027517795562744},{"x":0.752293586730957,"y":0.3211008906364441},{"x":0.7064220309257507,"y":0.2752293348312378},{"x":0.7247706651687622,"y":0.2293577790260315},{"x":0.8165137767791748,"y":0.22018343210220337},{"x":0.8256880640983582,"y":0.1834862232208252},{"x":0.963302731513977,"y":0.17431187629699707},{"x":0.963302731513977,"y":0.14678895473480225},{"x":0.8256880640983582,"y":0.14678895473480225},{"x":0.8623853325843811,"y":0.11926603317260742},{"x":0.7155963182449341,"y":0.07339447736740112},{"x":0.4403669834136963,"y":0.064220130443573},{"x":0.3486238420009613,"y":0.11926603317260742},{"x":0.1376146823167801,"y":0.027522921562194824},{"x":0.01834862306714058,"y":0.027522921562194824},{"x":0,"y":0.07339447736740112},{"x":0.11009174585342407,"y":0.17431187629699707},{"x":0.1376146823167801,"y":0.2568807005882263},{"x":0.08256880939006805,"y":0.29357796907424927},{"x":0.07339449226856232,"y":0.44954127073287964},{"x":0.12844036519527435,"y":0.5137614607810974},{"x":0.07339449226856232,"y":0.5871559381484985},{"x":0.07339449226856232,"y":0.7431192398071289},{"x":0.12844036519527435,"y":0.7889907956123352},{"x":0.12844036519527435,"y":0.853210985660553},{"x":0.00917431153357029,"y":0.963302731513977},{"x":0.00917431153357029,"y":1.0091742277145386}]}]},
    "particleEmitters": [
        {
            "position": "0.02 0.31",
            "trigger": "engine",
            "hasLight": true,
            "particle": {
                "effectFile": "core:flame",
                "size": 0.07,
                "tex": "core:smoke",
                "tint": "fire"
            },
            "workSounds": [
                "core:medEngineWork0",
                "core:medEngineWork1",
                "core:medEngineWork2",
                "core:medEngineWork3",
                "core:medEngineWork4"
            ]
        },
        {
            "position": "0.02 0.69",
            "trigger": "engine",
            "hasLight": true,
            "particle": {
                "effectFile": "core:flame",
                "size": 0.07,
                "tex": "core:smoke",
                "tint": "fire"
            },
            "workSounds": [
                "core:medEngineWork0",
                "core:medEngineWork1",
                "core:medEngineWork2",
                "core:medEngineWork3",
                "core:medEngineWork4"
            ]
        }
    ]
}