{
    "size": 0.41,
    "maxLife": 54,
    "type": "std",
    "price": 600,
    "hirePrice": 1000,
    "ability": {
        "type": "teleport",
        "angle": 90,
        "rechargeTime": 4
    },
    "displayName": "Bomber",
    "engine": "core:desertEngine",
    "gunSlots": [
        {
            "position": "0.32 0.32",
            "isUnderneathHull": false,
            "allowsRotation": false
        }
    ],
    "rigidBody": {
       "origin":{"x":0.4583333730697632,"y":0.5056817531585693},"polygons":[[{"x":0.7975000143051147,"y":0.6050000190734863},{"x":0.9800000786781311,"y":0.6450000405311584},{"x":0.7674999833106995,"y":0.8850000500679016}],[{"x":0.7674999833106995,"y":0.8850000500679016},{"x":0.4650000333786011,"y":0.9175000190734863},{"x":0.20500001311302185,"y":0.9300000667572021},{"x":0.032499998807907104,"y":0.7725000381469727},{"x":0.034999996423721313,"y":0.18999996781349182}],[{"x":0.034999996423721313,"y":0.18999996781349182},{"x":0.22749999165534973,"y":0.07749998569488525},{"x":0.44749999046325684,"y":0.07999995350837708},{"x":0.8000000715255737,"y":0.1525000035762787},{"x":0.7975000143051147,"y":0.6050000190734863},{"x":0.7674999833106995,"y":0.8850000500679016}]],"circles":[],"shapes":[{"type":"POLYGON","vertices":[{"x":0.9800000786781311,"y":0.6450000405311584},{"x":0.7674999833106995,"y":0.8850000500679016},{"x":0.4650000333786011,"y":0.9175000190734863},{"x":0.20500001311302185,"y":0.9300000667572021},{"x":0.032499998807907104,"y":0.7725000381469727},{"x":0.034999996423721313,"y":0.18999996781349182},{"x":0.22749999165534973,"y":0.07749998569488525},{"x":0.44749999046325684,"y":0.07999995350837708},{"x":0.8000000715255737,"y":0.1525000035762787},{"x":0.7975000143051147,"y":0.6050000190734863}]}]
    },
    "particleEmitters": [
        {
            "position": "0 0.33",
            "trigger": "engine",
            "hasLight": true,
            "particle": {
                "effectFile": "core:flame",
                "size": 0.07,
                "tex": "core:smoke",
                "tint": "fire"
            },
            "workSounds": [
                "core:medEngineWork0",
                "core:medEngineWork1",
                "core:medEngineWork2",
                "core:medEngineWork3",
                "core:medEngineWork4"
            ]
        },
        {
            "position": "0 0.67",
            "trigger": "engine",
            "hasLight": true,
            "particle": {
                "effectFile": "core:flame",
                "size": 0.07,
                "tex": "core:smoke",
                "tint": "fire"
            },
            "workSounds": [
                "core:medEngineWork0",
                "core:medEngineWork1",
                "core:medEngineWork2",
                "core:medEngineWork3",
                "core:medEngineWork4"
            ]
        }
    ]
}
